Headline,Body ID,Stance,prob_0,prob_1,prob_2,prob_3
DHS Rebuffs Congressman’s Claim ISIS Infiltrating Southern Border,1637,unrelated,3.444438e-07,1.9229064e-07,1.00599905e-07,0.9999994
"Rodney Constantine, Newfoundland Suspect, Keeps Facebook Pledge To Turn Himself In",828,agree,0.9497535,0.004523851,0.045706578,1.5998228e-05
Continuing Violence Puts Boko Haram Ceasefire In Jeopardy,903,unrelated,3.607528e-08,5.6666742e-09,3.310159e-05,0.99996686
Pumpkin Spice condoms? Don't fall for this hoax.,933,unrelated,1.1075792e-07,1.5038767e-08,3.971937e-06,0.99999595
Priest who died for 48 minutes says he met God and she’s a woman,1040,unrelated,1.552698e-08,1.8861684e-08,3.9947497e-07,0.9999995
Expert casts doubt on Bunbury man Dylan Thomas’s burrowing stomach-spider story,1860,disagree,0.4438139,0.55419934,0.0019777382,9.06961e-06
"Boko Haram leader denies ceasefire deal, says 200 abducted girls married off ",2272,discuss,0.0091295745,0.0007939249,0.9900727,3.7564066e-06
Apple Watch won’t be the digital doctor it could have been,382,unrelated,3.150052e-07,4.4843546e-08,3.7067712e-06,0.99999595
Angry mob hacks off alleged rapist's genitals with meat cleaver after dragging him into butchers,2523,unrelated,9.477194e-07,2.1350385e-08,1.091199e-08,0.99999905
"Vice Media CEO Shane Smith Spent $300,000 on Las Vegas Dinner (Report)",99,discuss,0.0005772758,2.1661092e-05,0.99939096,1.0087513e-05
Rats are still running around at Vogue,1036,unrelated,2.8445643e-06,2.8265086e-08,3.0551342e-05,0.9999666
Second person rushed to hospital with Ebola symptoms after contact with 'patient zero' Thomas Duncan,456,unrelated,3.1615187e-08,4.0250224e-08,1.4617021e-06,0.99999845
Ferguson riots: audio may have captured Michael Brown shooting,2118,discuss,8.519157e-06,2.7926433e-06,0.9997538,0.00023489005
Tropical spider 'burrowed under man's skin through scar' - video report,1708,unrelated,1.1329349e-08,6.4701254e-08,9.087611e-05,0.99990904
"U.S. accidentally delivered weapons to the Islamic State by airdrop, militants say",1363,discuss,0.005535423,0.00010477023,0.92264754,0.07171225
"Why the Gold Apple Watch Edition Must Cost $10,000",2483,unrelated,1.4637291e-07,5.624574e-09,2.0117342e-08,0.9999999
Sugarhill Gang rapper Big Bank Hank dies aged 57,1458,unrelated,2.184103e-09,4.0619543e-08,1.8690515e-07,0.99999976
#ISIS beheads photojournalist James Wright Foley in a massage to US to end its intervention in #Iraq.,1873,unrelated,3.6112309e-07,2.8007129e-08,1.604061e-07,0.9999994
"Nigeria's missing girls 'to be released by Boko Haram', government aide claims",2156,unrelated,2.2551161e-08,4.229688e-09,6.2600975e-08,0.9999999
"Cloistered nun gives birth to a baby  The convent: ""There is a sister"" [Google Translate]",2192,unrelated,4.927112e-09,8.083327e-09,1.3202222e-06,0.9999987
Boko Haram 'to release abducted schoolgirls' as part of ceasefire agreement,800,unrelated,6.0139467e-09,2.0153497e-09,4.5404854e-06,0.99999547
Saudi cleric condemns snowmen as anti-Islamic,2287,unrelated,3.4616232e-07,4.0863632e-08,1.1052423e-05,0.99998856
Bali Awry,1271,unrelated,1.950833e-07,1.13637945e-07,1.1684114e-05,0.99998796
‘Evil straight from the pits of hell': American journalist James Foley reportedly beheaded by ISIS,26,unrelated,2.2466578e-08,2.316656e-09,4.5761087e-07,0.9999995
BiH: Seven Primary School Students Pregnant After Five-Day Excursion,1408,unrelated,1.05397284e-07,6.8980266e-09,4.8585735e-09,0.9999999
"RCMP release security footage of Michael Zehaf Bibeau during attack, say he shot soldier in back",1866,discuss,0.053958636,5.1221654e-05,0.94598544,4.6918017e-06
"That Story About a Catholic Priest Dying, Seeing God as a Woman, and Coming Back to Life? It’s Almost Definitely Fake",777,unrelated,8.777757e-09,3.3288682e-08,3.2817485e-07,0.99999964
Judd Nelson rebuffs Internet rumors that he died of a drug overdose.,2332,agree,0.99280727,0.0049604676,0.002213925,1.833997e-05
Reports: Big Bank Hank of pioneering rap group Sugarhill Gang has died,754,unrelated,5.5758953e-09,8.2326856e-10,4.52966e-06,0.99999547
Texas Plumber Has ‘No Idea’ How Company Truck Ended Up With ISIS,1950,agree,0.9883327,0.0006465228,0.010441725,0.0005790973
Experts: More facts needed on purported audio recording of Michael Brown shooting,2403,unrelated,2.9183106e-08,4.361044e-08,7.265819e-06,0.9999926
Amazon's first brick-and-mortar store said to open in Manhattan,1355,unrelated,2.674305e-07,6.344346e-07,8.692894e-06,0.99999046
That ESPN Domestic Violence Panel You Keep Hearing About Isn't Real,1148,unrelated,9.955638e-05,5.139786e-06,1.0080141e-06,0.99989426
What Glenn Beck Fears May Be Done With the 11 Missing Jets,1747,unrelated,0.0004819028,8.273634e-06,1.8366138e-05,0.99949145
Hospital: Man not being treated for Ebola in Kansas City,1883,unrelated,2.0536977e-06,1.0429183e-06,3.0591352e-07,0.99999654
"Apple is limiting features on the Apple Watch to save battery life, according to developers",234,unrelated,1.6355268e-07,1.9126043e-07,2.1027013e-07,0.9999994
Batmobile wasn't stolen: Cops,1673,unrelated,3.6415302e-06,1.9938529e-08,1.06717415e-07,0.9999962
Spider burrowed through tourist's stomach and up into his chest,220,unrelated,5.92702e-08,5.3672444e-08,3.901087e-08,0.9999999
James Foley executioner said identified as British rapper  Read more: James Foley executioner said identified as British rapper,572,unrelated,6.7441612e-09,6.7047603e-09,5.045061e-08,0.9999999
Source: Tom Brokaw Wants Brian Williams Fired,2370,unrelated,2.7047242e-09,2.6604624e-08,6.1179755e-08,0.9999999
Meteorite Leaves House-Sized Crater in Nicaragua’s Capital,2155,unrelated,2.5875481e-08,2.9821376e-08,4.9221753e-06,0.999995
"James Foley, Missing American Photojournalist, Reportedly Executed By ISIS In Syria",367,unrelated,3.1612915e-09,2.9354228e-09,2.4119056e-06,0.9999976
James Foley Killer ‘Jihadi John’ Believed to Be Former London Rapper Abdel-Majed Abdel Bary,1314,discuss,3.8252518e-05,1.10273305e-07,0.9999616,4.1419742e-08
"Rumor: Stainless Steel Apple Watch Will Cost $500, Gold $4,000",2365,discuss,9.111227e-05,4.346557e-06,0.99905354,0.00085094245
Boko Haram 'to release abducted schoolgirls' as part of ceasefire agreement,1661,unrelated,3.5572372e-09,3.5594563e-09,4.587925e-06,0.99999535
Dog found abandoned outside railway station with suitcase of his belongings,1544,agree,0.9998004,4.7570127e-05,0.00015178067,3.4139563e-07
"Dead for 48 minutes, this Catholic Priest claims God is female",1212,unrelated,4.8416002e-08,9.823975e-08,1.4420636e-08,0.9999999
Seven girls fall pregnant after five day school trip in Bosnia and Herzegovina,2020,unrelated,4.4716083e-07,3.4577397e-08,1.4681427e-08,0.9999995
Iraq Says Arrested Woman Is Not The Wife of ISIS Leader al-Baghdadi,651,unrelated,4.0085865e-08,1.3475889e-07,4.868204e-08,0.99999976
BREAKING NEWS: Gunman 'shot dead' after wounding soldier near Canada parliament,964,unrelated,1.1504915e-08,1.19022e-08,2.3447152e-05,0.9999765
ISLAMIC STATE BEHEADS MISSING AMERICAN JOURNALIST JAMES WRIGHT FOLEY,1721,discuss,0.0016368323,1.9497718e-05,0.9983399,3.8169383e-06
Sugarhill Gang co-founder Big Bank Hank dies,1996,unrelated,4.9733664e-08,1.1059111e-08,9.898095e-09,0.9999999
PGA Spokesman and Tiger Woods' Agent Deny Drug Suspension Allegations,550,unrelated,2.432811e-07,3.4346876e-08,1.5124364e-07,0.9999995
"Luke Somers, American Hostage, Is Killed During Rescue Attempt in Yemen, U.S. Official Says",40,unrelated,1.08682086e-08,7.629607e-09,2.4256349e-06,0.9999975
Nun who GAVE BIRTH to baby boy after suffering agonising stomach pains 'had no idea' she was pregnant,2192,unrelated,2.7467626e-08,8.731821e-09,2.7956685e-07,0.99999964
"ISIS Video Shows Execution of David Cawthorne Haines, British Aid Worker",1178,unrelated,9.9014564e-08,5.1503437e-09,4.3144446e-06,0.9999956
"Calm down everyone, Banksy hasn't been arrested: 9 clues that it's a hoax",324,unrelated,3.0414803e-06,6.8639876e-09,9.411177e-08,0.9999969
"See How This Homeless Man Spends A Hundred Dollars, And Keep A Tissue Handy [Video]",794,disagree,0.0626607,0.9338352,0.0034950771,9.0237745e-06
A Predator Drone Has Reportedly Been Spotted Circling Above ISIS's Capital City,2412,discuss,0.0002821821,4.8195943e-05,0.62024975,0.3794199
"So, There Might Be a Rat Infestation at Vogue",639,unrelated,2.455302e-07,3.2616555e-07,0.00042868973,0.9995708
Judd Nelson rebuffs Internet rumors that he died of a drug overdose.,1875,unrelated,3.3934535e-07,1.1576609e-08,1.739159e-05,0.99998224
"That Story About a Catholic Priest Dying, Seeing God as a Woman, and Coming Back to Life? It’s Almost Definitely Fake",1808,unrelated,1.688524e-08,2.610129e-08,2.5275438e-07,0.99999976
Ottawa investigates reports that Isis has captured Canadian-Israeli woman,1899,discuss,8.167631e-06,7.655883e-07,0.999905,8.6086286e-05
Isis claims to behead US journalist,1747,discuss,0.0013852124,2.5063332e-06,0.99832934,0.00028299715
Kim Jong-Un's Scottish Dog Meat Restaurant Is Probably Fabricated Shite,1806,unrelated,7.110427e-08,8.854569e-09,5.6782847e-07,0.9999994
UPDATE: Internet report of Ebola outbreak in Purdon not true,1974,discuss,0.00035708115,2.4067238e-05,0.9992791,0.000339771
Ottawa shooting: Sergeant-at-arms Kevin Vickers hailed a hero for shooting rampaging gunman,1885,unrelated,6.208057e-07,1.16919786e-07,2.4903693e-07,0.99999905
PGA Tour Denies Claim That Tiger Woods Failed A Drug Test,550,unrelated,6.751772e-08,1.7011207e-09,4.768475e-08,0.9999999
Video messaging service verifies timing of CNN audio recording,413,unrelated,1.7829043e-06,4.4412957e-08,3.2438784e-06,0.9999949
Meteor Leaves 40-Foot Crater Near Managua's Airport,906,unrelated,2.5946812e-07,8.008616e-07,3.6823927e-08,0.9999989
Nationwide turkey recall? Ebola-infected birds? USDA debunks the hoax,1656,unrelated,2.6487548e-06,2.7407932e-06,1.244789e-05,0.9999821
Macaulay Culkin dead hoax: Fake death report spreads on social networks,2326,agree,0.99915826,3.1967433e-05,0.00080189423,7.863282e-06
Boko Haram 'ceasefire' doubts after attacks reported in Nigeria,2088,unrelated,2.6132316e-08,1.5093446e-08,5.751144e-07,0.9999994
How Canadian Sergeant-at-Arms Kevin Vickers killed shooter in parliament,1121,discuss,0.034906097,1.3991739e-05,0.9650766,3.290245e-06
Rapper identified as James Foley's executioner: reports,1263,unrelated,7.386215e-08,8.333788e-08,2.6860487e-06,0.99999714
Emotional sergeant-at-arms is greeted back to parliament with a rousing standing ovation a day after he heroically shot dead terrorist - the first time he used weapon in 30 year career,2404,unrelated,6.824269e-05,6.0565395e-07,0.006736764,0.99319434
U.S. arms airdrop fell into ISIS hands: Pentagon,1026,unrelated,7.6758096e-07,2.271522e-07,9.403764e-07,0.9999981
"11 Tripoli Planes Still Missing, Sparks 9/11 Concerns",1865,discuss,0.006760699,7.859237e-05,0.9931578,2.9592327e-06
Report: A Radically Redesigned 12-Inch MacBook Air Is Coming,568,unrelated,6.923265e-09,7.068572e-09,2.5391628e-06,0.9999975
"These LEGO Instructions from 1974 Are Awesome (And Yes, They're Real)",779,agree,0.9963406,0.00021028257,0.003181489,0.0002675778
"Video showing American journalist beheaded believed real, officials and family say",533,unrelated,0.0007780424,8.202399e-07,0.00010093445,0.9991202
Second person rushed to hospital with Ebola symptoms after contact with 'patient zero' Thomas Duncan,1289,unrelated,6.862528e-09,1.8826464e-08,2.5001157e-07,0.99999976
"At CBS Detroit, Fan Site 'Scuttlebutt' Is Enough to Publish Batmobile Rumor",964,unrelated,1.1352686e-08,3.729344e-09,1.5243384e-06,0.99999845
Islamic Militants Post Video Claiming to Show Beheading of U.S. Journalist,26,unrelated,7.487931e-08,6.125297e-09,0.00019019484,0.9998098
"Sorry, Fido. Pope Francis did NOT say our pets are going to heaven",1921,unrelated,8.006507e-09,9.935047e-10,2.4441695e-07,0.99999976
The Apple Watch Will Debut by Late March [Report],2154,unrelated,2.9847531e-09,6.25066e-09,3.3564454e-06,0.99999666
"RCMP release security footage of Michael Zehaf Bibeau during attack, say he shot soldier in back",186,unrelated,2.5235422e-06,1.3477944e-07,2.622839e-05,0.99997115
Comcast Says You Can Keep Your Tor,2187,unrelated,4.7206562e-08,8.076307e-09,4.1877516e-07,0.9999995
CNN Plays Alleged Audiotape of Michael Brown ShootingMilitarization Of Police,195,unrelated,2.0562869e-08,6.308126e-09,5.086831e-06,0.9999949
ESPN to save NFL's image with all-male domestic abuse discussion,373,unrelated,5.8812066e-09,3.0433647e-09,1.43366e-07,0.9999999
This Is The Most Epic Way To Quit Your Job,1877,unrelated,2.7852252e-07,1.9278657e-07,1.9725734e-07,0.9999993
ISIS Claims To Have Captured US Airdrop Weapons,2213,unrelated,2.9133002e-07,7.067734e-09,6.4140886e-07,0.99999905
"Woman detained in Lebanon is not Isis leader’s wife, says Iraq",691,unrelated,4.0458409e-07,2.281181e-07,4.1298872e-08,0.9999993
Christian Bale Exits Steve Jobs Movie (Exclusive),1077,unrelated,2.0458018e-07,6.316871e-08,2.8100567e-06,0.9999969
Bunbury local discovered a spider had burrowed under his skin on Bali holiday,1848,unrelated,3.1589053e-08,7.851874e-07,1.6475344e-08,0.99999917
"Rumor: Gold Apple Watch Edition priced up to $5,000, steel version at $500, will debut on Feb. 14",698,unrelated,2.9063585e-09,1.3765873e-09,5.095359e-07,0.9999995
Man who SLAPS people if they sneeze in public being hunted by police,1210,unrelated,5.660996e-08,3.1913223e-09,4.663388e-07,0.9999995
Report: British intelligence has identified Foley's killer,1478,unrelated,7.168617e-08,1.3570905e-08,1.2813562e-07,0.99999976
‘Evil straight from the pits of hell': American journalist James Foley reportedly beheaded by ISIS,874,unrelated,2.7448564e-08,1.9267212e-09,2.870404e-07,0.99999964
Islamic State using 'SCORPION bombs' to terrorise victims,2175,unrelated,1.1256421e-07,2.1216714e-08,2.248825e-06,0.9999976
New Audio Allegedly Captures Moment Michael Brown Was Shot,1289,unrelated,6.6745898e-09,6.8689645e-09,3.0954193e-06,0.9999969
"Hundreds of dog-lovers from around the world offer home to pet abandoned at the railway station with a suitcase containing his pillow, toy, bowl and favourite food",1642,agree,0.9993685,2.4741717e-05,0.0006030343,3.7738791e-06
Report: Fence jumper made it into East Room of White House,2068,unrelated,1.3134817e-08,3.8843107e-09,4.4376666e-06,0.9999956
Popular 'Banksy' Instagram account offers powerful message of perseverance after Paris attack,614,unrelated,4.2429793e-09,1.9586208e-08,3.8604148e-07,0.99999964
We took a look at the photo said to show the body of Islamic State leader Abu Bakr Al-Baghdadi (right) and found it was really an ethnic Albanian militant killed in 2013,2187,unrelated,2.6632692e-08,5.4989235e-09,4.4639603e-07,0.9999995
Former British Rapper Reportedly Under Investigation for James Foley Beheading,1079,discuss,0.0029568395,1.2628208e-05,0.99702686,3.6443748e-06
Jihadi John UNMASKED: Islamic State killer NAMED as west Londoner Mohammed Emwazi,2165,agree,0.9888948,1.6143847e-05,0.011078889,1.0123442e-05
"Boko Haram denies cease-fire, leader says he married off kidnapped girls",206,unrelated,2.3205482e-06,3.6246398e-08,3.2606425e-07,0.99999726
"PGA Tour Pro Claims Tiger Woods Is Currently Suspended For PEDs, Compares Him To Lance Armstrong",1175,unrelated,1.0381883e-08,2.781155e-09,5.0749698e-08,0.9999999
Return of the Mac: Seth Rogen in talks to star as Apple co-founder Steve Wozniak in upcoming Steve Jobs biopic,2453,unrelated,3.0801502e-08,1.815035e-08,4.6633036e-07,0.9999995
Apple Watch delayed for February in limited quantity,2278,unrelated,2.7913178e-08,4.642587e-09,1.6449484e-08,1.0
Seth Rogen to Play Apple Co-Founder Wozniak in Steve Jobs Biopic,2124,unrelated,1.4533655e-08,3.4071153e-08,1.9754746e-06,0.999998
CNN plays chilling audio recording allegedly from Michael Brown shooting: “At least 11 shots”,844,unrelated,1.2746653e-08,1.9550356e-08,1.428801e-06,0.99999857
#ISIS beheads photojournalist James Wright Foley in a massage to US to end its intervention in #Iraq.,2109,unrelated,1.7806441e-07,4.3292494e-09,9.3833e-06,0.99999046
"Big Bank Hank, US rapper and Sugarhill Gang founder member, dies at 57",2184,unrelated,5.6679344e-08,1.4170688e-08,3.8473445e-08,0.9999999
"Rumor: Apple shooting for 19 hours of Apple Watch battery life under normal conditions, 2.5 hours 'heavy' use",1904,unrelated,1.1364525e-06,3.8059497e-07,9.633746e-06,0.9999888
Apple 'working on 12-inch MacBook Air',1863,unrelated,3.2303273e-08,1.2659491e-07,2.578462e-06,0.99999726
Tropical spider burrowed under man's skin through appendix scar and lived there for THREE DAYS,1797,disagree,0.004099814,0.9952237,0.00067013496,6.429394e-06
That Was Fast: Christian Bale Bails on Steve Jobs Biopic,1406,unrelated,3.8016502e-08,9.913358e-09,3.3532575e-07,0.99999964
Ebola Scare in Kansas City,2104,discuss,0.0045678862,0.0003395601,0.99507785,1.4664846e-05
WAS NBC METEOROLOGIST MIKE SEIDEL PEEING IN THE SNOW ON CAMERA? A TESTY BRIAN WILLIAMS EXPLAINS,1855,discuss,6.8481513e-06,6.022756e-07,0.9999925,2.4292814e-09
Nigeria says it has deal with Boko Haram to release kidnapped girls,2530,discuss,6.35924e-06,1.0502192e-06,0.9999926,2.2373072e-08
WSJ: Apple cut watch health features due to erratic sensors,652,discuss,0.00040139543,0.00036579883,0.98991066,0.009322143
CNN Plays Alleged Audiotape of Michael Brown ShootingMilitarization Of Police,1252,unrelated,2.4479572e-09,4.9845066e-09,1.4675311e-06,0.99999857
A Letter Lego Sent to Parents in 1974 Holds an Important Message for the Parents of 2014,1292,agree,0.99289423,0.0009715963,0.0061333706,8.009285e-07
Kim Jong ill? Analysts say 27-year-old sister Kim Yo Jong may be running North Korea (VIDEO),87,unrelated,1.1282949e-07,6.550056e-09,3.943415e-06,0.99999595
"Christian Bale in talks to play Steve Jobs for Sony, Danny Boyle",1234,unrelated,3.918429e-09,3.9746784e-10,5.843082e-07,0.9999994
Audio of gunfire in Michael Brown case authenticated by app company,1921,unrelated,4.8968978e-08,7.825216e-09,1.7155027e-06,0.9999982
This Is What The Sun Baby From ‘Teletubbies’ Looks Like Now,2391,agree,0.6676451,0.016017217,0.19802368,0.11831403
Alleged audio of Michael Brown shooting has surfaced,1893,unrelated,2.595121e-09,3.0940314e-10,4.1252597e-06,0.9999958
Surreal Photos of Fisherman’s Jaw-Dropping Catch Will Likely Have People Wondering If It’s Real,1802,unrelated,6.0986935e-07,8.280143e-08,0.00011628683,0.99988306
Giant 8ft 9in catfish weighing 19 stone caught in Italy is thought to be the biggest ever reeled in with a rod and line,1183,unrelated,4.9607394e-08,3.4266158e-08,5.39695e-06,0.9999945
Has Ebola infected Isis militants in Mosul?,1506,discuss,4.703863e-06,9.3407033e-07,0.9999939,3.9486244e-07
Tiger Woods' agent shoots down report of failed drug test,2290,unrelated,1.6363509e-06,1.2756572e-08,1.8090373e-07,0.9999982
"Man cuts off manhood, throws it in the bin, after girlfriend leaves over small penis",842,unrelated,1.5119272e-05,4.5824557e-08,2.5488018e-06,0.99998224
"Everybody Relax, Banksy Wasn’t Arrested And Exposed As A 35-Year-Old Man",1595,unrelated,2.731873e-08,4.8930643e-10,3.153502e-08,1.0
Woman Says She Gave Her Cheating Man a Printout of His DMs for Christmas,882,unrelated,2.929327e-07,1.9083075e-08,1.04173715e-07,0.99999964
"Tour, agent: Tiger Woods not banned",1417,discuss,0.01838024,7.2964496e-05,0.98153394,1.2882217e-05
Marijuana Law New York: How No-Arrest Policy Could Make Things Worse For Minor Offenders ,1192,unrelated,1.459618e-08,2.230726e-08,2.5632098e-06,0.9999974
Lebanon detains wife and son of Al-Baghdadi,205,unrelated,2.277673e-05,6.7563263e-07,6.6085363e-06,0.99996996
Video: Marine survives Taliban sniper headshot thanks to helmet,56,unrelated,2.1527028e-06,7.2615305e-09,3.836996e-08,0.99999785
Christian Bale in Talks to Play Steve Jobs in Danny Boyle's Biopic,574,unrelated,1.047211e-09,6.535604e-10,3.6451547e-06,0.9999963
"Stainless steel Apple Watch could cost just $499, but gold will be 10 times as pricey",41,discuss,0.00022338868,1.9240866e-07,0.99976903,7.4392337e-06
Lebanon confirms holding ISIS chief’s kin,1817,unrelated,9.1112264e-07,1.6412044e-07,2.3604513e-05,0.9999753
CNN Plays Alleged Audiotape of Michael Brown ShootingMilitarization Of Police,2020,unrelated,2.686939e-06,4.5161192e-07,4.5922978e-05,0.9999509
Chinese advised to choose British-sounding names to get ahead,205,unrelated,2.484672e-06,6.4621595e-08,3.7870592e-07,0.999997
Now the Vogue Rats Are Chewing Through Couture,1693,discuss,0.002574043,6.9734024e-06,0.9974075,1.1437682e-05
ISIS fighters 'have contracted Ebola': World Health Organisation investigating reports militants showed up at Iraqi hospital with lethal disease,1461,unrelated,2.1203046e-09,1.4930134e-09,1.5143594e-06,0.99999845
"Islamic State, in video titled ""A Message to America,"" beheads American journalist James Wright Foley who was kidnapped in 2012",1721,discuss,0.0027709242,3.82261e-05,0.99718994,9.4334894e-07
ADVISORY-Islamist rebel leader killed in U.S. strike - Somali government,1024,unrelated,3.6929757e-06,1.8605459e-07,4.64686e-06,0.9999914
CNN plays chilling audio recording allegedly from Michael Brown shooting: “At least 11 shots”,2481,discuss,5.9147845e-07,6.9078203e-07,0.99999857,1.8747726e-07
Video shows dramatic moment bullet strikes U.S. Marine’s head — and he survives thanks to kevlar helmet,2185,unrelated,2.475537e-07,7.225126e-08,2.3861799e-06,0.99999726
"White House Fence-Jumper Overpowered Secret Service Officer, Ran Through Much of Main Floor",2068,unrelated,7.099749e-08,3.3192669e-09,4.0816158e-07,0.9999995
Texas plumber's truck on front line of Syria war,803,unrelated,4.2739033e-05,9.694075e-08,8.196739e-07,0.99995637
ISIS leader ‘killed’ in US airstrikes,511,unrelated,8.2079836e-08,1.7917644e-09,5.9697754e-07,0.9999993
Tropical spider 'burrowed under man's skin through scar' - video report,220,unrelated,1.1946709e-08,1.8646876e-08,2.5761567e-06,0.9999974
Saudi Arabia Cleric Issues Fatwa Against Building Snowmen,1498,discuss,0.009311705,0.0001710088,0.99051625,1.0082969e-06
#Hairgate: iPhone 6 users say device pulls out hair,1519,discuss,0.00043888116,7.5203493e-06,0.9995284,2.5148815e-05
Saudi cleric condemns snowmen as anti-Islamic,1857,unrelated,2.4080728e-07,2.8994608e-08,4.1576413e-06,0.9999956
Jordanian airstrike killed American aid worker held hostage by ISIS according to statement by militants,1968,unrelated,8.900546e-08,9.3747076e-08,3.3230614e-07,0.9999995
Batman Set To Play Steve Jobs In Upcoming Biopic,1406,unrelated,1.1586043e-08,2.396523e-08,4.1409646e-07,0.9999995
This Guy Paid Off His Parents’ Mortgage For Christmas,2036,discuss,0.0030399596,0.00027530023,0.996678,6.781857e-06
BREAKING: ISIS USES CHEMICAL WEAPONS – Murders 300 Iraqi Soldiers in Chlorine Gas Attack,2002,discuss,0.0025230595,5.382793e-05,0.9974004,2.2719782e-05
Alleged audio of Michael Brown shooting released,2250,discuss,6.9433295e-06,2.1191929e-07,0.99999166,1.1519131e-06
Small Meteorite Hits Managua,373,unrelated,4.131842e-08,5.4338567e-08,3.5534717e-07,0.9999995
Is the Alleged Audio of the Gunshots That Killed Michael Brown a Hoax?,2317,discuss,0.0044755843,0.0006310896,0.9948921,1.1835847e-06
Emotional sergeant-at-arms is greeted back to parliament with a rousing standing ovation a day after he heroically shot dead terrorist - the first time he used weapon in 30 year career,704,unrelated,3.1062623e-08,2.6679006e-08,5.078553e-07,0.9999994
Canadian Soldier Shot At Ottawa War Memorial: Report,2156,discuss,0.08960038,0.00029750363,0.9099415,0.00016060862
"Nigeria, Boko Haram reach ceasefire deal, kidnapped girls to go free, official says",2191,discuss,2.9165535e-06,1.5725473e-07,0.9999969,6.491706e-09
British Man Slaps People If They Sneeze In Public,634,discuss,0.2218263,0.00019657509,0.77796465,1.24406915e-05
Meteorite Leaves House-Sized Crater in Nicaragua’s Capital,170,unrelated,1.4363783e-08,6.1031233e-09,1.6071041e-07,0.99999976
Judd Nelson Death Hoax: FOX News Impersonator Claims Actor Found Dead In Los Angeles Condo,35,unrelated,1.5505135e-07,5.9417875e-09,2.614404e-08,0.99999976
"Big Bank Hank, US rapper and Sugarhill Gang founder member, dies at 57",1996,unrelated,7.5070176e-08,1.7347395e-08,1.2770226e-08,0.9999999
ISLAMIC STATE BEHEADS MISSING AMERICAN JOURNALIST JAMES WRIGHT FOLEY,1606,unrelated,0.00014557967,4.0889046e-07,0.001520243,0.99833375
Eggnog-chugging contest leads to hospital stay,1853,unrelated,6.762254e-06,5.2345325e-08,2.9150917e-07,0.99999285
"Catholic Priest Dead For 48 Minutes, Is Miraculously Revived – His Revelations About God Are Even More Shocking",1014,agree,0.997465,0.0014570714,0.0010428907,3.4984903e-05
Ebola Frisco 2014: Patient Shows Virus Symptoms After Apparent Thomas Eric Duncan Contact,1901,unrelated,5.216167e-06,1.16303376e-07,4.1403173e-06,0.9999906
Armed U.S. drones spotted flying over Syria in possible hunt for ISIS leader,1657,discuss,0.00116404,6.726953e-05,0.99873024,3.8384733e-05
Christian Bale quits Steve Jobs movie,2313,unrelated,4.0048533e-08,4.5761883e-09,1.1508761e-06,0.9999988
Kim Jong-Un 'bans the name Kim Jong-un',1975,unrelated,6.464877e-08,7.395323e-09,1.364577e-07,0.99999976
Parents' anger after seven Bosnian schoolgirls aged 13 and 14 fall pregnant on class trip,2230,unrelated,6.084016e-09,2.6231788e-09,2.0183475e-07,0.99999976
Journalist James Wright Foley reportedly beheaded by ISIS,984,unrelated,3.1423028e-08,3.8569752e-08,0.00021204702,0.99978787
Report—Jose Canseco accidentally shot at his home tonight,695,unrelated,9.6062855e-09,4.3654835e-09,6.0115667e-06,0.9999939
Nun Gives Birth To Baby Boy After Suffering Intense Stomach Pains,1760,unrelated,2.4107618e-07,4.386483e-09,7.780665e-06,0.999992
Doubts cast over Nicaragua meteorite claim,1948,unrelated,3.467683e-07,1.3323231e-08,9.162466e-06,0.99999046
Two GOP Congressmen Say Suspected Terrorists Caught Crossing U.S.–Mexico Border,2056,unrelated,5.577366e-10,1.043764e-08,1.5066956e-06,0.99999845
